{"kind":"message-reference","version":{"major":0,"minor":1},"producer":{"id":"dev.intlify/js-reference","revision":"0.1.0"},"identity":{"namespace":{"kind":"project"},"segments":["js","module","src","app.ts"]},"deliveryUnit":["main"],"references":[{"scope":{"namespace":{"kind":"project"},"name":"app"},"domain":"json-pointer","selector":{"kind":"exact","key":"/title"},"origin":{"source":{"namespace":{"kind":"project"},"path":["src","app.ts"]},"span":{"start":1,"end":7}}},{"scope":{"namespace":{"kind":"project"},"name":"app"},"domain":"json-pointer","selector":{"kind":"pattern","pattern":"/items/*"},"reason":"bounded set\n"}]}
